{
  "schema": "change_transition_v1",
  "tenant_id": "synthetic-tenant-a",
  "id": "00000000-0000-4000-8000-00000000001e",
  "change_id": "00000000-0000-4000-8000-00000000000a",
  "revision_from": 0,
  "revision_to": 1,
  "from_state": "NONE",
  "to_state": "DRAFT",
  "kind": "CHANGE_CREATED",
  "actor_id": "synthetic-analyst",
  "occurred_at": "2026-10-29T03:34:56.123456Z",
  "previous_snapshot_sha256": null,
  "next_snapshot_sha256": "b00497c3f51bfd739fbbb76ea57660dbb05cbae7214050214eaf85063f30e65c",
  "evaluation_run_id": null,
  "evaluation_run_sha256": null,
  "decision_id": null,
  "decision_sha256": null,
  "assessment_sha256": null
}
